[
  {
    "id": "upstream-01",
    "source": {"repository": "ran-j/PS2Recomp", "branch": "pull/304", "revision": "e88054b", "upstream_base": "eb8688b",
               "files": ["ps2xRecomp/src/lib/ps2_recompiler.cpp"], "authors": ["Peter J De Sousa (VariableDeclared)"]},
    "title": "Decode a delay slot that lies past the function's end (PR #304, issue #370)",
    "category": "B", "subsystem": "recompiler/delay-slots",
    "problem": "A branch in a function's last word got a synthetic NOP delay slot; the real instruction was dropped silently (FIFA Street 2 crash per #370).",
    "approach": "decodeFunction decodes one extra word after end when the last instruction has a delay slot. Extended here: slices keep the trailing delay slot and the emitter decodes it from the ELF section with a warning.",
    "scope": "general", "scope_evidence": "MIPS executes the word at branch+4 for every branch (except an untaken likely branch).",
    "reference": "MIPS R5900 branch delay slot semantics", "license": "GPL-3.0", "upstream_equivalent": "ran-j/PS2Recomp#304 (open)",
    "risk": "low", "priority": 1, "status": "INTEGRATED",
    "evidence": {"analysis": "diff read; both slicing sites in ps2_recompiler.cpp found to cut the same way",
                 "tests_added": ["a delay slot past the function's end is still translated", "a delay slot past the decoded range is translated from the ELF section", "a delay slot outside every section still falls back to a NOP"],
                 "integration_commit": "e88054b, f8292ed", "build": "MSVC 14.44 Release OK",
                 "regression": "ps2x_tests 454/454; mutation (emitter fallback disabled) fails the section test"},
    "limitations": "Configured instruction patches are not applied to a delay slot recovered by the emitter fallback."
  },
  {
    "id": "upstream-02",
    "source": {"repository": "ran-j/PS2Recomp", "branch": "pull/268", "revision": "dbe446b", "files": ["ps2xRecomp/src/lib/vu_translation_helpers.cpp"], "authors": ["drakolordx7"]},
    "title": "VCALLMSR starts from CMSAR0 instead of vi[27] (PR #268, issue #262)",
    "category": "D", "subsystem": "recompiler/VU0 macro",
    "problem": "Generated code read ctx->vi[27] from uint16_t vi[16]: out-of-bounds UB, wrong microprogram (CoD: WaW Final Fronts AI/camera failures per #262).",
    "approach": "Read ctx->vu0_cmsar0, which CTC2 $vi27 writes.",
    "scope": "general", "scope_evidence": "VCALLMSR always uses CMSAR0 (PCSX2 COP2.cpp: vu0ExecMicro(VU0.VI[REG_CMSAR0])).",
    "reference": "PCSX2 pcsx2/COP2.cpp, pcsx2/VU.h", "license": "GPL-3.0", "upstream_equivalent": "ran-j/PS2Recomp#268 (open)",
    "risk": "low", "priority": 1, "status": "INTEGRATED",
    "evidence": {"tests_added": ["VCALLMSR starts the microprogram from CMSAR0, not a VI array slot"], "integration_commit": "dbe446b",
                 "build": "MSVC 14.44 Release OK", "regression": "ps2x_tests 454/454"},
    "limitations": "vi[] is still 16 entries; the other VU0 control registers keep their separate fields."
  },
  {
    "id": "upstream-03",
    "source": {"repository": "ran-j/PS2Recomp", "branch": "pull/310", "revision": "b60446a", "files": ["ps2xRecomp/src/lib/vu_translation_helpers.cpp"], "authors": ["Yan Moura (yanm1103)"]},
    "title": "VU0 macro LQI/LQD/SQI/SQD/ILWR/ISWR operands and VU0 data memory (PR #310, issue #309)",
    "category": "D", "subsystem": "recompiler/VU0 macro",
    "problem": "SQI/SQD swapped fs/it (OOB vi[16..31] write); all six instructions accessed EE RAM 0x0000-0x3FF0 instead of VU0 data memory (ICO camera corruption per #309).",
    "approach": "Correct field decode; access runtime->memory().getVU0Data() with qword wrap. Extended here: vi0/vf0 stay hardwired.",
    "scope": "general", "scope_evidence": "Encoding and semantics match PCSX2 VUops.cpp _vuSQI/_vuLQD/_vuILWR/_vuISWR.",
    "reference": "PCSX2 pcsx2/VUops.cpp", "license": "GPL-3.0", "upstream_equivalent": "ran-j/PS2Recomp#310 (open)",
    "risk": "low", "priority": 1, "status": "INTEGRATED",
    "evidence": {"tests_added": ["VU0 LQI/LQD/SQI/SQD decode fields and use VU0 data memory", "VU0 ILWR/ISWR address VU0 data memory by qword and field", "VU0 macro loads/stores keep vi0 and vf0 hardwired"],
                 "integration_commit": "b60446a, f8292ed", "build": "MSVC 14.44 Release OK", "regression": "ps2x_tests 454/454"},
    "limitations": "VU0 addresses 0x4000+ (VU1 register mirror) wrap inside 4 KiB instead of mapping VU1 registers."
  },
  {
    "id": "upstream-04",
    "source": {"repository": "ran-j/PS2Recomp", "branch": "issues/258 + pull/298 + pull/347", "revision": "eb8688b", "files": ["ps2xRuntime/src/lib/ps2_runtime.cpp", "ps2xRuntime/src/lib/Kernel/EeScheduler.cpp"]},
    "title": "EE invocation stacks off the main thread's stack, reused per thread (issue #258)",
    "category": "C", "subsystem": "runtime/EE scheduler",
    "problem": "Interrupt/callback stacks were carved from the top of RAM where SetupThread puts the main stack (Ridge Racer V game loop died per #258), and were never reclaimed (PR #298 fallback shown to re-alias in #347).",
    "approach": "Own design: low region [0x90000, min(0xF0000, ELF start)) first (PR #298's tested range), free list on thread dormancy, cleared on reset, logged fallback.",
    "scope": "general", "scope_evidence": "Any title that takes an interrupt during a nested call on the main thread.",
    "reference": null, "license": "GPL-3.0", "upstream_equivalent": "ran-j/PS2Recomp#298 (partial, open)",
    "risk": "medium", "priority": 1, "status": "INTEGRATED",
    "evidence": {"tests_added": ["async callback stacks come from below the ELF before the top of RAM", "threads that come and go reuse invocation stacks instead of exhausting them"],
                 "integration_commit": "6460dd7", "build": "MSVC 14.44 Release OK",
                 "regression": "ps2x_tests 454/454, ps2xIOP ctest 4/4; mutation (no release) fails the churn test"},
    "limitations": "A title that loads an ELF below 0x90000 gets no low region and uses the logged fallback."
  },
  {
    "id": "upstream-05",
    "source": {"repository": "ran-j/PS2Recomp", "branch": "issues/259", "revision": "eb8688b", "files": ["ps2xRuntime/src/lib/Kernel/Syscalls/System.cpp"]},
    "title": "SetupThread(-1) records the stack base like CreateThread (issue #259)",
    "category": "C", "subsystem": "runtime/EE kernel",
    "problem": "GuestThread::stack was a top for the SetupThread main thread and a base for CreateThread threads.",
    "approach": "Store top - size; returned $sp and stack location unchanged.",
    "scope": "general", "scope_evidence": "Kernel bookkeeping used by ReferThreadStatus for every title.",
    "reference": "Play! Source/ee/PS2OS.cpp sc_SetupThread / sc_ReferThreadStatus", "license": "GPL-3.0", "upstream_equivalent": null,
    "risk": "low", "priority": 2, "status": "INTEGRATED",
    "evidence": {"tests_added": ["SetupThread exposes stable main stack metadata through ReferThreadStatus (updated expectation)"],
                 "integration_commit": "257c5c5", "build": "MSVC 14.44 Release OK", "regression": "ps2x_tests 454/454"},
    "limitations": "For SetupThread(-1) the runtime still tops the stack at 0x02000000 - size; Play! uses RAM size - 4 KiB. Not changed without more evidence."
  }
]
